{
  "manifestVersion": "1.0",
  "capabilityId": "urn:rosetta:capability:22222222-2222-4222-8222-222222222222:echo",
  "providerAppId": "22222222-2222-4222-8222-222222222222",
  "version": "1.0.0",
  "title": "Technical echo",
  "description": "Technical interoperability fixture; returns the supplied value without domain rules.",
  "inputSchema": {
    "type": "object",
    "properties": {
      "value": {
        "type": "string",
        "maxLength": 512
      }
    },
    "required": [
      "value"
    ],
    "additionalProperties": false
  },
  "outputSchema": {
    "type": "object",
    "properties": {
      "value": {
        "type": "string",
        "maxLength": 512
      }
    },
    "required": [
      "value"
    ],
    "additionalProperties": false
  },
  "invocation": {
    "protocol": "http-json",
    "method": "POST",
    "path": "/capabilities/echo",
    "mediaType": "application/json"
  },
  "requiredPermissions": [
    "urn:rosetta:permission:22222222-2222-4222-8222-222222222222:invoke"
  ],
  "sideEffects": {
    "kind": "none",
    "description": "No persistent or external effects.",
    "idempotency": "none"
  },
  "timeoutMs": 1000,
  "preconditions": {
    "approval": "none",
    "platform": [
      "caller-active",
      "provider-active",
      "grant-active",
      "same-tenant"
    ]
  }
}
